{
  "schema_version": "1.0",
  "name": "weather_forecasting",
  "title": "Weather Forecasting",
  "description": "This pattern is designed to help get the weather forecast for a given airport code. It creates a project, EE, and job templates in automation controller to get the weather forecast.",
  "short_description": "This pattern is designed to help get the weather forecast for a given airport code.",
  "tags": ["weather", "forecasting"],
  "aap_resources": {
    "controller_project": {
      "name": "Weather Forecasting",
      "description": "Project for the Weather Forecasting pattern"
    },
    "controller_execution_environment": {
      "name": "Weather Forecasting",
      "description": "EE for the Weather Forecasting pattern",
      "image_name": "weather-demo-ee",
      "pull": "missing"
    },
    "controller_labels": ["weather", "forecasting"],
    "controller_job_templates": [
      {
        "name": "Get Weather Forecast",
        "description": "This job template gets the weather at the location of a provided airport code.",
        "execution_environment": "Weather Forecasting",
        "playbook": "site.yml",
        "primary": true,
        "labels": ["weather", "forecasting"],
        "survey": {
          "name": "Weather Forecasting",
          "description": "Survey to configure the weather forecasting pattern",
          "spec": [
            {
              "type": "text",
              "question_name": "Location",
              "question_description": "Enter the airport code for which you want to get the weather forecast",
              "variable": "location",
              "required": true
            }
          ]
        }
      }
    ]
  }
}
